{
  "kind": "generator/v1",
  "provenance": {
    "source": "experiments/platform/core/fuzz.mjs (xorshift32, seed 0x11c0ffee, 10,000 runs)",
    "license": "Apache-2.0 OR MIT",
    "author": "murmo"
  },
  "generator": "provenance",
  "seed": 297861102,
  "sizes": {
    "pr": 1000,
    "nightly": 10000
  },
  "session": "fresh",
  "target": {
    "kind": "editor-ops",
    "trust": "builtin"
  },
  "failures": "provenance/regressions.json"
}
